id,title,url,source,published_date,author,content,disaster_keywords_found,indonesia_location_keywords_found,event_score,rejection_reason,scraped_at
tempo.co_bc8d24ddbdcd,Longsor Siklon Senyar Pangkas 7 Persen Orang Utan Tapanuli,https://www.tempo.co/lingkungan/longsor-siklon-senyar-pangkas-7-persen-orang-utan-tapanuli-2268344,Tempo.co,10 Juni 2026 | 22.42 WIB,,"SEKITAR tujuh persen populasi orang utan Tapanuli yang berstatus kritis terancam punah ( critically endangered ) diduga lenyap akibat satu peristiwa cuaca ekstrem. Temuan ini merupakan fokus utama studi yang dipublikasikan di jurnal Current Biology, yang menganalisis dampak Siklon Senyar terhadap orang utan Tapanuli di Indonesia. Berdasarkan keterangan resmi Borneo Futures dan World Weather Attribution, para peneliti menemukan curah hujan ekstrem dari Siklon Senyar pada November 2025 memicu longsor di blok barat ekosistem Batang Toru, wilayah yang menjadi habitat populasi orang utan Tapanuli terbesar yang tersisa. Tim ilmuwan menganalisis jejak longsoran yang terekam melalui citra satelit dan menggabungkannya dengan estimasi kepadatan orangutan di kawasan tersebut. Scroll ke bawah untuk melanjutkan membaca Hasil analisis menunjukkan sekitar 58 individu orang utan Tapanuli diperkirakan tewas akibat longsor. Jumlah tersebut setara dengan sekitar 11 persen populasi orang utan Tapanuli yang hidup di Blok Barat Batang Toru, atau sekitar 7 persen dari jumlah yang masih bertahan di alam liar. Kepala Ilmuwan Borneo Futures, Erik Meijaard, mengatakan kehilangan populasi dalam jumlah tersebut sangat signifikan bagi spesies yang jumlahnya sudah sangat sedikit. “Jika digabungkan dengan tekanan yang sudah berlangsung, seperti degradasi habitat dan konflik manusia-satwa liar. Kondisi ini semakin menegaskan urgensi penerapan rencana aksi konservasi yang terkoordinasi dan didukung sumber daya yang memadai,” kata Erik dalam keterangan tertulis, Rabu, 10 Juni 2026. Penelitian itu juga menemukan sekitar 8.300 hektare hutan atau 11,7 persen tutupan hutan di Blok Barat Batang Toru terdampak longsor yang dipicu hujan ekstrem. Profesor ilmu iklim Imperial College London, Friederike Otto, menyinggung keterkaitan erat antara perubahan iklim dan hilangnya keanekaragaman hayati. “Dengan meningkatkan intensitas hujan pada Siklon Senyar hingga 50 persen, perubahan iklim yang dipicu manusia mengubah badai tropis yang parah menjadi pemicu bencana longsor yang menghancurkan,” kata Otto. Untuk mengetahui pengaruh perubahan iklim terhadap peristiwa tersebut, para peneliti menggunakan metode atribusi iklim ( climate attribution ). Hasil analisis menunjukkan perubahan iklim akibat aktivitas manusia meningkatkan intensitas hujan selama Siklon Senyar sebesar 9 hingga 50 persen. Pascabanjir bandang yang menghancurkan permukiman di Desa Tanjung Karang, Kabupaten Aceh Tamiang, Aceh, 12 Desember 2025. Siklon Tropis Senyar yang terbentuk di Selat Malaka pada akhir November 2025 memicu anomali cuaca ekstrem di wilayah Sumatera. Fenomena ini memicu banjir bandang dan tanah longsor yang parah. Hingga awal Desember 2025, BNPB mencatat ratusan korban jiwa dan hampir satu juta warga terpaksa mengungsi di seluruh wilayah terdampak. Tempo/Ilham Balindra Profesor Departemen Biologi Universitas Indonesia Jatna Supriatna menyebut hilangnya puluhan orangutan Tapanuli akibat satu peristiwa longsor sebagai pukulan besar bagi spesies kera besar paling langka di dunia. “Untuk mencegah kepunahan pertama spesies kera besar pada era modern, Indonesia harus memberikan perlindungan permanen bagi Ekosistem Batang Toru,” ujarnya. Dia menambahkan, upaya konservasi memerlukan dukungan internasional melalui pendanaan pemulihan keanekaragaman hayati yang lebih cepat dan memadai. Senada, primatolog Liverpool John Moores University Serge Wich mengatakan peristiwa cuaca ekstrem dapat berdampak besar terhadap populasi satwa yang jumlahnya kecil dan terfragmentasi. “Sangat tragis kehilangan begitu banyak kera dengan cara seperti ini. Ini sangat mengkhawatirkan bagi masa depan spesies ini,” tutur Moores. Adapun peneliti longsor Nottingham Trent University Dave Petley menyatakan aliran material longsor terhubung langsung dengan sistem aliran sungai. Longsor itu berlangsung cepat dan sangat merusak. “Mereka yang berada di jalur longsoran hampir tidak memiliki waktu peringatan ataupun kesempatan untuk menyelamatkan diri,” ucap dia.","banjir, bnpb, korban jiwa, longsor, tanah longsor","aceh, bnpb, indonesia, kabupaten, sumatera",6,,2026-06-15T19:02:36.505841+00:00
tempo.co_697a5daca2bf,"Korban Gempa Mindanao Terus Bertambah, 37 Tewas",https://www.tempo.co/lingkungan/korban-gempa-mindanao-terus-bertambah-37-tewas-2254050,Tempo.co,10 Juni 2026 | 12.26 WIB,,"SEDIKITNYA 37 orang tewas dan sekitar 500 lainnya mengalami luka-luka setelah gempa bumi bermagnitudo 7,8 mengguncang wilayah selatan Filipina pada Senin pagi, 8 Juni 2026, waktu setempat. Gempa yang berpusat di lepas pantai Pulau Mindanao itu juga memaksa lebih dari 32.000 warga mengungsi serta menyebabkan kerusakan luas pada infrastruktur, sekolah, dan jaringan listrik. Berdasarkan data Kantor Pertahanan Sipil Filipina pada Selasa, 9 Juni 2026, sebagian besar korban meninggal disebabkan oleh tanah longsor yang dipicu gempa, tenggelam, serta luka akibat tertimpa puing bangunan yang runtuh. Di Provinsi Sarangani, sedikitnya 14 orang tewas setelah tanah longsor menimbun rumah-rumah di kaki gunung. Scroll ke bawah untuk melanjutkan membaca Selain menelan korban jiwa, gempa tersebut menyebabkan puluhan ribu orang meninggalkan rumah mereka dan mengungsi ke tempat-tempat penampungan darurat. Banyak warga memilih mengungsi karena khawatir akan ancaman tsunami setelah gempa kuat tersebut. Seperti dikutip laporan Antara, Institut Vulkanologi dan Seismologi Filipina menyatakan gempa tektonik terjadi pada pukul 07.37 waktu setempat dengan kedalaman 33 kilometer. Pusat gempa berada sekitar 32 kilometer di barat daya pesisir Maasim, Provinsi Sarangani, di Pulau Mindanao. Meski gelombang tsunami setinggi hingga 1,4 meter tercatat di sejumlah wilayah Filipina, laporan kerusakan akibat tsunami relatif terbatas. Otoritas setempat hanya melaporkan kerusakan pada enam rumah panggung di sebuah desa pesisir. Gelombang yang lebih kecil juga terpantau mencapai Indonesia, Palau, hingga Jepang bagian selatan. Kerusakan paling parah terjadi di General Santos City, kota pelabuhan berpenduduk lebih dari 700 ribu jiwa yang dikenal sebagai pusat industri tuna Filipina. Sedikitnya 13 orang dilaporkan tewas akibat bangunan runtuh dan tertimpa puing di kota tersebut. Departemen Pekerjaan Umum dan Jalan Raya Filipina memperkirakan nilai kerusakan properti di General Santos City mencapai 1 miliar peso Filipina atau sekitar US$16,2 juta atau sekitar Rp 293 miliar. Pemerintah Filipina juga masih melakukan pemeriksaan terhadap bangunan-bangunan yang roboh maupun mengalami kerusakan berat untuk memastikan tidak ada korban yang masih terjebak. Hingga Selasa, empat orang masih dinyatakan hilang.","gempa, gempa bumi, kerusakan, korban jiwa, longsor, tanah longsor, tsunami","indonesia, kota, provinsi",8,,2026-06-15T19:02:39.047156+00:00
tempo.co_95558b2db77f,"Gempa Susulan Mindanao M5,0 di Laut Sulawesi Guncang Sangihe",https://www.tempo.co/lingkungan/gempa-susulan-mindanao-m5-0-di-laut-sulawesi-guncang-sangihe-2254031,Tempo.co,10 Juni 2026 | 11.10 WIB,,"BADAN Meteorologi, Klimatologi, dan Geofisika ( BMKG ) melaporkan gempa tektonik mengguncang wilayah Laut Sulawesi, Kepulauan Sangihe, Sulawesi Utara, pada hari Rabu, 10 Juni 2026, pukul 08.54.21 WIB Hasil analisis BMKG menunjukkan gempa bumi ini memiliki parameter update dengan magnitudo M5,0. Episenter gempa bumi terletak pada koordinat 5,59° LU dan 125,28° BT, atau tepatnya berlokasi di laut pada jarak 220 kilometer arah Barat Laut Pulau Karatung, Sulawesi Utara pada kedalaman 54 kilometer. Scroll ke bawah untuk melanjutkan membaca ”Dengan memperhatikan lokasi episenter dan kedalaman hiposenternya, gempa bumi yang terjadi merupakan jenis gempa bumi dangkal akibat aktivitas subduksi lempeng,” ujar Direktur Gempa Bumi dan Tsunami BMKG Wijayanto dalam keterangannya, Rabu. ”Hasil analisis mekanisme sumber menunjukkan bahwa gempa bumi memiliki mekanisme pergerakan geser-naik ( oblique thrust ),” tambahnya. Berdasarkan estimasi peta tingkat guncangan ( shakemap ), gempa bumi ini dirasakan dengan skala intensitas III MMI di Kepulauan Marore, Kepulauan Sangihe, Miangas ( Kepulauan Talaud), serta skala intensitas II - III MMI di Kendahe, Kepulauan Sangihe. Hingga saat ini belum ada laporan dampak kerusakan yang ditimbulkan akibat gempa bumi tersebut. Hasil pemodelan menunjukkan bahwa gempa bumi ini tidak berpotensi tsunami. Gempa bumi ini merupakan rangkaian susulan dari gempa bumi M7,7 di Mindanao, Filipina, pada tanggal 8 Juni 2026 pukul 06.37.42 WIB. Hingga 10 Juni 2026 pukul 09.10 WIB, hasil monitoring BMKG menunjukkan adanya 218 aktivitas gempa bumi susulan ( aftershock ), dengan magnitudo terbesar M6,7.","gempa, gempa bumi, kerusakan, tsunami",sulawesi,2,,2026-06-15T19:02:41.364919+00:00
tempo.co_ca31b32d535b,"Data Dampak Gempa M7,8 dan Tsunami yang Terjadi di Mindanao",https://www.tempo.co/lingkungan/data-dampak-gempa-m7-8-dan-tsunami-yang-terjadi-di-mindanao-2253689,Tempo.co,8 Juni 2026 | 20.10 WIB,,"SEDIKITNYA 19 orang dilaporkan tewas setelah gempa bumi berkekuatan Magnitudo 7,8 (BMKG mengumumkan M7,7) mengguncang wilayah selatan Filipina pada Senin pagi, 8 Juni 2026. Gempa itu juga memicu peringatan tsunami di beberapa wilayah pesisir. Juru bicara otoritas setempat, Junie Castillo, mengatakan 19 orang meninggal, 134 orang luka-luka, dan 12 lainnya masih dinyatakan hilang pada Senin siang waktu setempat. Namun, jumlah korban tersebut masih dalam proses verifikasi. Menurut laporan terbaru, jumlah korban luka telah meningkat menjadi lebih dari 200 orang. Melansir laporan AP News, korban jiwa tersebar di sejumlah wilayah terdampak, termasuk Kota General Santos dan daerah lain di Provinsi South Cotabato, Provinsi Sarangani, Provinsi Davao Occidental, dan Pulau Balut. Sebagian besar korban meninggal akibat bangunan runtuh dan tanah longsor yang dipicu gempa. Di Kota General Santos yang berada dekat pusat gempa, sejumlah bangunan mengalami kerusakan berat. Rekaman video yang beredar memperlihatkan runtuhnya lantai atas sebuah restoran cepat saji serta robohnya sebagian dinding luar sebuah kompleks komersial. Filipina diguncang gempa dengan magnitudo M 7,7 pada Senin pagi, 8 Juni 2026. Di Provinsi Davao del Sur, sebagian bangunan sekolah menengah atas dilaporkan runtuh ketika para siswa sedang berkumpul di luar gedung. Dampak gempa juga dirasakan pada sektor pendidikan dan transportasi. Gempa terjadi pada hari pertama sekolah kembali dibuka setelah libur musim panas. Lebih dari 100 siswa dilaporkan mengalami memar dan beberapa lainnya pingsan akibat kepanikan saat upacara bendera pagi berlangsung. Sementara itu, sebuah toko serba ada di Kota General Santos mengalami kerusakan parah pada bagian pintu masuk, dengan kaca pecah, dan bangku-bangku berserakan di jalan. Bandara Internasional General Santos sempat ditutup sementara dan sedikitnya 17 penerbangan domestik dibatalkan akibat dampak gempa. Petugas Kepolisian Kota General Santos, Robert Dagon, mengatakan banyak bangunan terdampak gempa. “Tapi saya belum bisa merinci jumlahnya sekarang karena kami masih sibuk dengan operasi penyelamatan yang sedang berlangsung,” kata Dagon, dikutip dari laporan The Guardian, 8 Juni 2026. Gempa juga menyebabkan pemadaman listrik di sejumlah wilayah. Selain itu, ribuan warga dilaporkan mengungsi dari rumah mereka akibat kerusakan bangunan dan kekhawatiran terhadap gempa susulan. Menurut laporan awal Institut Vulkanologi dan Seismologi Filipina, pusat gempa berada sekitar 13 kilometer di barat daya Kota General Santos, Pulau Mindanao, dengan kedalaman sekitar 10 kilometer. Gempa terjadi pada pukul 07.37 waktu setempat. Sementara itu, Survei Geologi Amerika Serikat (USGS) mencatat gempa berkekuatan magnitudo 7,8 dengan kedalaman sekitar 55 kilometer. Tak lama setelah gempa terjadi, Pusat Peringatan Tsunami Pasifik memperingatkan potensi gelombang tsunami hingga tiga meter di beberapa wilayah pesisir Filipina. Gelombang hingga satu meter juga diperkirakan mencapai sejumlah kawasan pesisir Indonesia dan Malaysia. Gelombang tsunami setinggi hingga 1,4 meter kemudian terpantau di wilayah pesisir Kota Kiamba, Provinsi Sarangani. Sedikitnya enam rumah panggung di sebuah desa pesisir di Provinsi Zamboanga del Sur dilaporkan mengalami kerusakan akibat gelombang tersebut. Scroll ke bawah untuk melanjutkan membaca","gempa, gempa bumi, kerusakan, korban jiwa, longsor, tanah longsor, tsunami","indonesia, kota, provinsi",10,,2026-06-15T19:02:45.700667+00:00
tempo.co_066e34bb79b6,"Gempa Terkini Getarkan Padang Pariaman, Ini Data BMKG",https://www.tempo.co/lingkungan/gempa-terkini-getarkan-padang-pariaman-ini-data-bmkg-2253660,Tempo.co,8 Juni 2026 | 18.18 WIB,,"GEMPA bumi berkekuatan Magnitudo 4,5 mengguncang wilayah Padang Pariaman, Sumatera Barat, pada Senin, 8 Juni 2026, pukul 13.39 WIB. Badan Meteorologi, Klimatologi, dan Geofisika (BMKG) menyatakan gempa dari laut tapi tidak sampai berpotensi menimbulkan tsunami dan hingga saat ini dilaporkan tidak ada dampak kerusakan yang berarti. Berdasarkan analisis BMKG, episenter gempa terkini yang guncangannya bisa dirasakan di wilayah Indonesia itu berada di laut pada jarak sekitar 28 kilometer di sebelah selatan Kabupaten Padang Pariaman. Adapun kedalaman pusat gempa tercatat di angka 68 kilometer di bawah laut. Scroll ke bawah untuk melanjutkan membaca Kepala Stasiun Geofisika Padang Panjang, Suaidi Ahadi, menjelaskan bahwa karakteristik gempa ini tergolong gempa dalam. ""Dengan memperhatikan lokasi dan kedalaman pusat gempa, kejadian ini merupakan gempa dalam akibat adanya aktivitas zona subduksi,"" ujarnya dalam keterangan tertulis pada Senin 8 Juni 2026. Meski tergolong gempa dalam, guncangan tetap dirasakan oleh warga di beberapa daerah sekitarnya. Berdasarkan estimasi peta guncangan BMKG, getaran terasa di Kota Padang, Kabupaten Padang Pariaman, dan Kota Pariaman pada skala II–III MMI. Pada intensitas tersebut, getaran dirasakan oleh banyak orang di dalam rumah, terasa seperti ada truk besar yang melintas, dan benda-benda ringan yang tergantung tampak bergoyang. BMKG menyatakan belum menerima laporan adanya kerusakan bangunan maupun korban jiwa akibat gempa ini. Hasil pemantauan juga menunjukkan belum ada aktivitas gempa susulan yang terdeteksi pasca-gempa utama. BMKG mengimbau masyarakat untuk tetap tenang. ""Warga diharapkan terus memantau informasi resmi dari BMKG melalui kanal-kanal komunikasi resmi yang tersedia,"" kata Suaidi.","gempa, gempa bumi, kerusakan, korban jiwa, tsunami","indonesia, kabupaten, kota, padang, sumatera",1,,2026-06-15T19:02:47.894654+00:00
tempo.co_ab56de5c4bd7,"Info Lengkap Dampak Gempa Mindanao M7,7 di Indonesia",https://www.tempo.co/lingkungan/info-lengkap-dampak-gempa-mindanao-m7-7-di-indonesia-2253628,Tempo.co,8 Juni 2026 | 16.55 WIB,,"GEMPA bumi berkekuatan besar yang mengguncang wilayah Mindanao, Filipina, pada Senin pagi, 8 Juni 2026, memicu tsunami minor di sejumlah wilayah Indonesia bagian timur. Badan Meteorologi, Klimatologi, dan Geofisika (BMKG) mencatat kenaikan muka air laut di beberapa daerah, dengan gelombang tertinggi mencapai 0,75 meter di Talengan, Sulawesi Utara. Kepala BMKG Teuku Faisal Fathani mengatakan gempa terjadi pada pukul 06.37 WIB dengan pusatnya berada di laut, sekitar 244 kilometer barat laut Pulau Karatung, Sulawesi Utara, pada kedalaman 47 kilometer. Gempa dangkal tersebut dipicu aktivitas subduksi lempeng ( gempa megathrust) dengan mekanisme sesar naik. Scroll ke bawah untuk melanjutkan membaca Dampak tsunami terdeteksi di sejumlah wilayah pesisir Indonesia. “Hasil pemantauan BMKG, terjadi kenaikan tinggi muka air laut di sejumlah wilayah,” kata Faisal dalam keterangan tertulis. BMKG mencatat kenaikan tinggi muka air laut di Loloda setinggi 0,09 meter pada pukul 07.20 WIB, Ulu Siau 0,18 meter dan Melonguane 0,32 meter pada pukul 07.27 WIB. Selain itu, sensor pasang surut air laut di Tahuna merekam kenaikan muka air laut setinggi 0,3 meter pada pukul 06.58 WIB. Kenaikan juga terpantau di Paleleh sebesar 0,45 meter pada pukul 07.34 WIB dan Tanjung Sidupa 0,32 meter pada pukul 07.39 WIB. Pada pukul 07.51 WIB, tinggi muka air laut di Bitung mencapai 0,29 meter dan di Ternate 0,14 meter. Gelombang tertinggi tercatat di Talengan dengan ketinggian 0,75 meter pada pukul 08.20 WIB. Sebelum gelombang tsunami tiba, gempa M7,7 itu lebih dulu memberi dampak guncangan yang dirasakan kuat di sejumlah wilayah Indonesia. Deputi Bidang Geofisika BMKG Nelly Florida mengatakan wilayah Miangas dan Melonguane mengalami guncangan dengan intensitas VI MMI. Pada skala itu, getaran membuat terkejut penduduk dan membuat mereka berlarian keluar, selain menyebabkan kerusakan ringan seperti plester dinding yang jatuh serta kerusakan cerobong asap. Sementara itu, wilayah Siau dan Tagulandang merasakan guncangan dengan intensitas V MMI atau dirasakan oleh semua penduduk serta membuat banyak terbangun dari tidurnya. Pada skala ini, gempa mampu membuat gerabah pecah, barang-barang terpelanting, serta tiang-tiang dan barang besar tampak bergoyang. Getaran juga dirasakan di Morotai, Halmahera Utara, dan Manado dengan intensitas IV MMI. Sejumlah daerah lain seperti Toli-Toli, Kabupaten Gorontalo, Ternate, Halmahera Barat, Palu, Bitung, hingga Bolaang Mongondow Timur turut merasakan gempa dengan intensitas III hingga IV MMI. “Getaran dirasakan nyata dalam rumah. Terasa getaran seakan-akan ada truk berlalu,” kata Nelly. BMKG juga mencatat aktivitas gempa susulan (aftershock). “Hingga pukul 10.00 WIB, hasil monitoring BMKG menunjukkan adanya 20 aktivitas gempa bumi susulan dengan magnitudo terbesar 3,9–6,7,” tutur Nelly. Meski demikian, berdasarkan hasil pemantauan terkini, BMKG memastikan tidak ada lagi kenaikan muka air laut signifikan yang membahayakan masyarakat. Karena itu, peringatan dini tsunami resmi diakhiri. “BMKG menyatakan bahwa Peringatan Dini Tsunami dinyatakan berakhir pada 10:15:51 WIB.” BMKG tetap mengimbau masyarakat di wilayah terdampak untuk memeriksa kondisi bangunan sebelum kembali beraktivitas. Direktur Gempabumi dan Tsunami BMKG Wijayanto meminta warga memastikan tidak ada kerusakan struktural yang membahayakan. “Apabila masih terdapat kerusakan atau retakan-retakan, perlu menjadi perhatian dan tidak langsung masuk ke dalam ruangan,” ucap Wijayanto. Kepala Basarnas Sulawesi Utara, George L. M. Randang, melaporkan sebanyak dua rumah di Kabupaten Kepulauan Sangihe, Sulawesi Utara, usak ringan akibat gempa ini. Selain rumah rusak ringan, kata George, terinformasi juga ada tiga warga yang mengalami luka ringan. “Kami terus mendalami informasi yang kami terima dengan mengerahkan personel di lapangan,"" tuturnya dikutip dari Antara.","gempa, gempa bumi, kerusakan, tsunami","indonesia, kabupaten, manado, sulawesi",6,,2026-06-15T19:02:50.108940+00:00
tempo.co_8f15e56e143d,"Gempa M7,7 Berpotensi Tsunami di Sulut, Cek Estimasinya",https://www.tempo.co/lingkungan/gempa-m7-7-berpotensi-tsunami-di-sulut-cek-estimasinya-2253513,Tempo.co,8 Juni 2026 | 08.17 WIB,,"GEMPA bumi tektonik dengan magnitudo 7,7 mengguncang wilayah Laut Sulawesi pada Senin pagi, 8 Juni 2026 pukul 06:37 WIB, dengan pusat gempa berada di kedalaman 47 kilometer di sebelah barat laut Pulau Karatung, Sulawesi Utara. Badan Meteorologi Klimatologi dan Geofisika (BMKG) telah mengeluarkan pemutakhiran peringatan dini tsunami atas gempa bumi tersebut untuk wilayah pesisir Sulawesi Utara, Gorontalo, Sulawesi Tengah, Maluku Utara, termasuk Kalimantan Timur. Scroll ke bawah untuk melanjutkan membaca Merespons peringatan dini potensi tsunami akibat guncangan gempa bumi tersebut, Badan Nasional Penanggulangan Bencana (BNPB) mengimbau masyarakat di lima wilayah pesisir itu untuk tetap tenang, meningkatkan kewaspadaan penuh, serta secara sadar dan teratur melakukan langkah antisipasi mandiri dengan bergerak menjauhi area pantai menuju titik kumpul aman sesuai dengan tingkat ancaman di wilayahnya. Berdasarkan hasil pemodelan dampak tsunami oleh BMKG, pemerintah daerah di tingkat provinsi, kabupaten, dan kota yang berada dalam status Siaga diinstruksikan untuk segera mengarahkan masyarakatnya melakukan evakuasi secara tertib menuju tempat yang lebih tinggi. Kepala Pusat Data, Informasi, dan Komunikasi Kebencanaan BNPB Abdul Muhari mengatakan wilayah berstatus Siaga ini mencakup beberapa titik di Sulawesi Utara dengan estimasi waktu tiba gelombang mulai dari Kepulauan Sangihe pada pukul 06:51 WIB, Kota Manado pukul 07:12 WIB, Minahasa Utara Bagian Utara pukul 07:12 WIB, Minahasa Bagian Utara pukul 07:14 WIB, Kepulauan Minahasa pukul 07:16 WIB, Minahasa Selatan Bagian Utara pukul 07:17 WIB, hingga Bolaang Mongondow Bagian Utara pukul 07:22 WIB. ""Di samping itu, status Siaga juga berlaku untuk Gorontalo Bagian Utara dengan estimasi kedatangan gelombang pada pukul 07:26 WIB, diikuti wilayah Sulawesi Tengah, yaitu Buol, pukul 07:27 WIB dan Toli-Toli pukul 07:29 WIB, serta kembali ke wilayah Sulawesi Utara untuk Minahasa Utara Bagian Selatan pada pukul 07:33 WIB dan Minahasa Bagian Selatan pada pukul 07:34 WIB,"" kata Muhari melalui keterangan tertulis, Senin, 8 Juni 2026. Sementara itu, bagi pemerintah daerah dan masyarakat yang berada di wilayah dengan status Waspada, BNPB meminta agar kesiapsiagaan tetap dijaga dengan segera mengarahkan warga untuk menjauhi kawasan pantai maupun tepian sungai, serta menghentikan sementara segala aktivitas di perairan. ""Wilayah yang masuk dalam kategori Waspada ini meliputi Kepulauan Talaud dengan estimasi waktu tiba gelombang pukul 06:58 WIB, Kota Bitung pukul 07:19 WIB, Halmahera di Maluku Utara pukul 07:29 WIB, Donggala Bagian Utara di Sulawesi Tengah pukul 07:42 WIB, serta Minahasa Selatan Bagian Selatan pukul 07:42 WIB."" Kewaspadaan serupa, kata dia, juga berlaku untuk Kota Ternate pada pukul 07:43 WIB, Kutai Timur di Kalimantan Timur pukul 07:44 WIB, Kota Tidore pukul 07:46 WIB, hingga wilayah Bulungan pada pukul 08:05 WIB dan Nunukan pada pukul 08:14 WIB. BNPB mengonfirmasi bahwa situasi dan kondisi di lapangan saat ini terpantau aman, tenang, dan terkendali. ""Berdasarkan laporan cepat dari Pusat Pengendali dan Operasi (Pusdalops) Badan Penanggulangan Bencana Daerah (BPBD) Kabupaten Kepulauan Talaud serta BPBD Kota Manado, guncangan gempa bumi di kedua wilayah tersebut hanya dirasakan lemah selama kurang lebih 2 hingga 3 detik,"" ujar Muhari. Hingga saat ini, menurut Muhari, tim gabungan BPBD di masing-masing daerah terus melakukan monitoring ketat secara berkala di lapangan guna memantau setiap dampak yang ditimbulkan pasca-gempa serta memastikan kondisi pesisir tetap aman. BNPB, kata dia, terus memperkuat koordinasi sinergis dalam satu komando bersama tim gabungan lintas instansi di daerah, mulai dari BPBD, TNI, Polri, Basarnas, hingga lembaga kemanusiaan dan relawan penanggulangan bencana di lapangan, yang telah bersiaga penuh untuk memandu dan mengamankan jalur pergerakan warga. ""Masyarakat diimbau untuk tidak panik, memberikan prioritas keselamatan bagi kelompok rentan seperti lansia, penyandang disabilitas, dan anak-anak, serta selalu mematuhi instruksi resmi dari petugas lintas instansi yang mengawal situasi di lapangan."" ""Warga juga diingatkan untuk tidak menyebarkan isu atau informasi yang belum jelas kebenarannya, dan selalu merujuk pada pemutakhiran data berkala dari instansi terkait dan petugas di lapangan,"" ucap dia menambahkan.","bnpb, bpbd, evakuasi, gempa, gempa bumi, tsunami","bnpb, bpbd, kabupaten, kalimantan, kota, maluku, manado, provinsi, sulawesi",3,,2026-06-15T19:02:59.118017+00:00
