id,title,url,source,published_date,author,content,disaster_keywords_found,indonesia_location_keywords_found,event_score,rejection_reason,scraped_at
kumparan.com_dc2a048b38b7,Andre Rosiade & IKM Bantu Perantau Minang Korban Kebakaran Kemayoran,https://kumparan.com/kumparannews/andre-rosiade-and-ikm-bantu-perantau-minang-korban-kebakaran-kemayoran-27bSqnHc5Oo,Kumparan.com,15 Juni 2026 23:07 WIB,kumparanNEWS,"15 Juni 2026 23:07 WIB · waktu baca 3 menit DPP Ikatan Keluarga Minang (IKM) memberikan bantuan kepada perantau Minang yang menjadi korban kebakaran di kawasan Pasar Jiung, Kelurahan Kebon Kosong, Kecamatan Kemayoran, Jakarta Pusat. Pemberian bantuan tersebut dihadiri langsung oleh Ketua Umum DPP IKM Andre Rosiade. Andre menyerahkan bantuan sebesar Rp 1 juta kepada masing-masing kepala keluarga perantau Minang yang terdampak kebakaran. Sebanyak 23 kepala keluarga menerima bantuan tersebut. “Ini adalah bentuk kepedulian dan kebersamaan keluarga besar IKM untuk membantu perantau Minang yang sedang tertimpa musibah. Mudah-mudahan bantuan ini bisa sedikit meringankan beban saudara-saudara kita dan menjadi penyemangat untuk bangkit kembali,” kata Andre dalam keterangannya, Senin (15/6). Wakil Ketua Komisi VI DPR RI itu mengatakan, bantuan yang diberikan mungkin tidak mampu menutupi seluruh kerugian yang dialami para korban. Namun diharapkan dapat meringankan beban sekaligus menjadi penyemangat untuk bangkit kembali setelah musibah. Menurut Andre, semangat gotong royong dan rasa persaudaraan merupakan nilai yang harus terus dijaga oleh perantau Minang di mana pun berada. Karena itu, IKM akan selalu hadir membantu masyarakat Minang yang mengalami kesulitan maupun musibah. Termasuk kebakaran yang terjadi 1 Juni 2026 malam itu. Data yang disampaikan dalam kegiatan tersebut menyebutkan kebakaran di kawasan Pasar Jiung menghanguskan sekitar 523 rumah. Dari jumlah tersebut, sedikitnya 23 kepala keluarga perantau Minang turut menjadi korban dan menerima bantuan dari DPP IKM. Sekretaris DPD IKM Jakarta Pusat, Patriuni, menyampaikan apresiasi dan terima kasih kepada Andre Rosiade beserta jajaran IKM yang telah hadir langsung memberikan bantuan kepada para korban kebakaran. “Saya mewakili pengurus DPD IKM Jakarta Pusat menyampaikan terima kasih kepada Bapak Andre Rosiade dan seluruh jajaran yang telah memberikan perhatian dan bantuan kepada masyarakat yang menjadi korban kebakaran di Kelurahan Kebon Kosong, Kemayoran. Kami berharap bantuan ini dapat bermanfaat dan meringankan beban warga yang terdampak,” ujar Patriuni. Sementara itu, Ketua DPW IKM DKI Jakarta, Mochamad Yunaldi, menilai langkah yang dilakukan Andre Rosiade menunjukkan kuatnya solidaritas dan kepedulian keluarga besar Minang terhadap sesama perantau. “Terima kasih kepada Pak Andre Rosiade yang telah bergerak cepat membantu warga yang terdampak. Ini menjadi bukti bahwa perantau Minang selalu solid dan saling membantu ketika ada saudara kita yang tertimpa musibah. IKM akan terus hadir di tengah masyarakat dan menjadi rumah besar bagi seluruh perantau Minang,” kata Yunaldi. Pada kesempatan tersebut, Andre juga menyampaikan kabar gembira bagi para perantau Minang pecinta sepak bola. DPP IKM, kata dia, akan memborong 50.000 tiket pertandingan kandang Semen Padang FC di Stadion Patriot Bekasi dan membagikannya secara gratis kepada perantau Minang. “Pertandingan pertama dan kedua Semen Padang FC sudah diborong tiketnya oleh DPP IKM. Total 50.000 tiket akan kami bagikan secara gratis kepada perantau Minang. Kita tunjukkan bahwa perantau Minang ada di mana-mana dan siap memberikan dukungan penuh kepada Semen Padang FC,” ujar Andre, Presiden Klub Semen Padang FC. Andre menambahkan, dukungan tersebut merupakan bagian dari upaya mempererat silaturahmi perantau Minang. Selain itu juga untuk memberikan semangat kepada Semen Padang FC yang akan menjalani musim kompetisi dengan berkandang sementara di Bekasi karena Stadion Haji Agus Salim Padang sedang dibangun ulang. Penyerahan bantuan dihadiri pengurus DPP IKM, DPW IKM DKI Jakarta, DPD IKM Jakarta Pusat, dan DPC IKM Kemayoran itu. Kegiatan berlangsung hangat dan penuh kekeluargaan.",kebakaran,"jakarta, padang, ri",3,,2026-06-15T19:03:49.933784+00:00
kumparan.com_b2bb1d157db2,"Rudal Rusia Hantam Katedral Bersejarah Ukraina, 11 Orang Tewas",https://kumparan.com/kumparannews/rudal-rusia-hantam-katedral-bersejarah-ukraina-11-orang-tewas-27bLwGUyq1T,Kumparan.com,15 Juni 2026 16:22 WIB,kumparanNEWS,"15 Juni 2026 16:22 WIB · waktu baca 2 menit Rusia melancarkan serangan rudal dan drone besar-besaran ke sejumlah kota di Ukraina pada Senin (15/6), yang menewaskan sedikitnya 11 orang dan memicu kebakaran di Katedral Dormition, bagian dari kompleks biara bersejarah Kyiv-Pechersk Lavra yang berstatus Situs Warisan Dunia UNESCO. Jurnalis AFP di Kyiv melaporkan warga berlarian mencari perlindungan sepanjang malam saat sistem pertahanan udara berupaya mencegat rudal dan drone yang menghujani ibu kota Ukraina. Menteri Dalam Negeri (Mendagri) Ukraina Igor Klymenko mengatakan lima petugas penyelamat tewas saat memadamkan kebakaran akibat serangan berulang Rusia di kota Kharkiv. Lima orang lainnya tewas dan 25 orang terluka di Kyiv, sementara satu korban jiwa dilaporkan di kota Kherson yang berada dekat garis depan pertempuran. Angkatan Udara Ukraina menyebut Rusia meluncurkan 70 rudal dan 611 drone dalam serangan tersebut, dengan sebagian besar mengarah ke Kyiv. Militer Rusia mengklaim serangan itu menargetkan fasilitas militer Ukraina di Kyiv serta wilayah Kharkiv dan Dnipro. Presiden Ukraina Volodymyr Zelensky mengecam serangan yang menyebabkan atap Katedral Dormition terbakar dan menyebutnya sebagai salah satu serangan paling serius terhadap warisan budaya Kristen. ""Ini adalah salah satu kejahatan paling serius Rusia terhadap budaya Kristen hingga saat ini,"" kata Zelensky, dikutip AFP. Ia juga mendesak para pemimpin G7 yang sedang berkumpul di Prancis untuk memberikan respons yang lebih tegas terhadap Moskow. ""Kami membutuhkan lebih banyak tekanan terhadap agresor dan lebih banyak dukungan bagi pertahanan udara Ukraina, khususnya kemampuan anti-rudal balistik,"" ujarnya. Di sisi lain, serangan drone Ukraina ke kota Tula di Rusia, sekitar 200 kilometer di selatan Moskow, dilaporkan menewaskan tiga orang dan melukai tiga lainnya menurut otoritas setempat.","kebakaran, korban jiwa",kota,2,,2026-06-15T19:04:05.685010+00:00
kumparan.com_b3c5300e577c,BYD Klarifikasi Insiden Kebakaran di Pabrik Subang: Tak Ganggu Operasional,https://kumparan.com/kumparanoto/byd-klarifikasi-insiden-kebakaran-di-pabrik-subang-tak-ganggu-operasional-27aMcrHs0ow,Kumparan.com,15 Juni 2026 17:30 WIB,kumparanOTO,"15 Juni 2026 17:30 WIB · waktu baca 2 menit BYD Indonesia angkat bicara terkait kabar kebakaran yang terjadi di fasilitas produksinya di Subang, Jawa Barat pada 4 Juni 2026 lalu. Perusahaan menegaskan insiden tersebut bukan peristiwa besar dan tidak berdampak signifikan terhadap operasional. Head of Marketing PR and Government Relations BYD Indonesia, Luther Panjaitan, menjelaskan titik api hanya muncul di bagian kecil bangunan, tepatnya di area atap. Ia menyebut kejadian itu dipicu oleh kelalaian pihak kontraktor yang sedang bekerja di lokasi proyek. ""Memang ada sedikit keteledoran dari oknum pihak kontraktor sehingga menyebabkan ada bagian kecil di posisi atap yang terbakar,"" kata Luther saat ditemui di Jakarta, Kamis (12/6). Menurutnya, kepulan asap yang terlihat besar disebabkan oleh jenis material yang terbakar. Meski area terdampak terbatas, bahan tersebut menghasilkan asap pekat sehingga terlihat mencolok dari kejauhan. ""Karena material yang terbakar itu tertentu, menyebabkan asap yang cukup tebal. Namun memang terlihat asapnya ngebul karena material yang terbakar berbahan plastik dan karet,"" ujarnya. Luther memastikan penanganan insiden berlangsung cepat dan terkendali. Api disebut berhasil dipadamkan dalam waktu singkat tanpa perlu penanganan besar dari luar. ""Tapi setelah pemadaman secara mandiri dan ada fasilitas pemadaman juga, hanya dalam waktu 10 menit selesai,"" tutur dia. Ia juga menegaskan bahwa insiden tersebut tidak mengganggu proses pembangunan pabrik yang saat ini memasuki tahap akhir. Seluruh aktivitas di lokasi disebut tetap berjalan normal seperti biasa. ""Aktivitas pabrik tetap berjalan, tidak terganggu, termasuk persiapan finalisasinya,"" kata Luther. Sebelumnya, beredar video di media sosial yang memperlihatkan kepulan asap hitam dari sebuah bangunan yang diduga merupakan pabrik BYD di Subang, Jawa Barat. Narasi yang menyertai video tersebut menyebut kebakaran terjadi akibat puntung rokok dan membuat pekerja panik. Dalam rekaman itu, tampak bangunan yang belum sepenuhnya rampung mengeluarkan asap tebal. Video tersebut diambil dari sudut pandang gedung lain yang lebih tinggi, sehingga memperlihatkan area proyek secara keseluruhan. Adapun pabrik BYD di Subang merupakan salah satu investasi besar perusahaan jenama China ini di Indonesia dengan nilai mencapai Rp 11,2 triliun. Fasilitas ini ditargetkan segera beroperasi dan diproyeksikan mampu menyerap hingga 3.000 tenaga kerja.",kebakaran,"indonesia, jakarta, jawa barat",3,,2026-06-15T19:04:12.418633+00:00
liputan6.com_d06dfd852578,"Kebakaran Hebat Dekat Balai Kota Depok, Lebih dari 5 Toko Ludes",https://www.liputan6.com/news/read/7890963/kebakaran-hebat-dekat-balai-kota-depok-lebih-dari-5-toko-ludes,Liputan6.com,2026-06-14T19:41:12+07:00,Liputan6.com,"Liputan6.com, Jakarta - Kebakaran melanda kawasan padat penduduk di dekat Balai Kota Depok. Sejumlah toko semi permanen di Jalan Naming Botin, Pancoran Mas, Kota Depok, hangus terbakar dan api sempat mengancam permukiman warga, Minggu (14/6/2026). Salah seorang saksi Ricky Juliansyah mengatakan semula melihat kepulan asap hitam saat melintas di Jalan Arif Rahman Hakim, tidak jauh dari Balai Kota Depok dan Stasiun Depok Baru. Karena penasaran, Ricky mendatangi lokasi dan mendapati beberapa toko semi permanen telah dilalap api. ""Saat sampai di sini, api sudah membakar beberapa ruko semi permanen,"" ujar Ricky. Ricky bersama warga sempat berupaya memadamkan api menggunakan air sumur sambil menunggu petugas Dinas Pemadam Kebakaran dan Penyelamatan (Damkar) Kota Depok. Namun, api dengan cepat membesar dan merambat ke bangunan lainnya. ""Api cepat banget nyamber ke toko di sebelahnya. Yang terbakar lebih dari lima toko,"" kata Ricky. Menurutnya, material kayu yang digunakan pada sejumlah bangunan membuat kobaran api cepat membesar. Petugas Damkar yang tiba di lokasi langsung berupaya mencegah api merambat ke permukiman padat penduduk. ""Kayaknya sudah ada beberapa rumah warga yang terbakar. Kejadiannya cepat, pemilik toko ada yang tidak sempat menyelamatkan barangnya,"" ujarnya. Para pemilik toko hanya bisa pasrah melihat tempat usahanya hangus dilalap api. Sejumlah warga bahkan tampak menangis. ""Tadi ada beberapa orang yang menangis melihat tokonya terbakar,"" ucap Ricky. Sementara itu, Kepala Bidang Pengendalian Operasional Damkar Kota Depok, Tessy Haryati, mengatakan petugas masih berjibaku memadamkan api. ""Tiga mobil Damkar dan 12 personel sedang bekerja untuk memadamkan api,"" kata Tessy.",kebakaran,"jakarta, kota",1,,2026-06-15T19:04:28.736009+00:00
liputan6.com_b4bb0754d8e4,ASDP Dampingi Pemulihan Korban Kebakaran Kapal Aceh Hebat 2,https://www.liputan6.com/bisnis/read/7890182/asdp-dampingi-pemulihan-korban-kebakaran-kapal-aceh-hebat-2,Liputan6.com,2026-06-12T20:58:23+07:00,Liputan6.com,"Liputan6.com, Jakarta - PT ASDP Indonesia Ferry (Persero) memastikan penanganan korban kebakaran KMP Aceh Hebat 2 di Dermaga Pelabuhan Ulee Lheue, Banda Aceh. Pendampingan pemulihan korban terus dilakukan pihak perusahaan. Direktur Utama ASDP, Heru Widodo menyebut, ada 15 orang korban terdampak kebakaran KMP Aceh Hebat 2 tersebut. Dia memastikan perhatian dan fokus utama perusahaan saat ini tertuju pada penanganan para korban yang terdampak akibat kejadian tersebut. “Kami ingin memastikan bahwa para korban dan keluarga tidak menghadapi situasi ini sendirian. Fokus utama kami saat ini adalah memastikan seluruh korban mendapatkan penanganan medis terbaik serta pendampingan yang diperlukan,” kata Heru dalam keterangan resmi, Jumat (12/6/2026). Dalam proses penanganannya, sekitar 15 orang yang mengalami luka bakar telah dievakuasi ke rumah sakit untuk mendapatkan perawatan lebih lanjut. ASDP terus mendampingi serta berkoordinasi dengan pihak terkait guna memantau perkembangan kondisi para korban dan memastikan seluruh kebutuhan penanganan dapat terpenuhi dengan baik. “Atas nama manajemen ASDP, saya menyampaikan keprihatinan yang mendalam atas musibah ini,"" kata dia. ""Pikiran dan perhatian kami saat ini sepenuhnya tertuju kepada para korban yang sedang menjalani perawatan serta keluarga yang mendampingi mereka. Kami turut mendoakan agar seluruh korban diberikan kekuatan dan dapat segera pulih,” Heru menambahkan. Saat ini perusahaan terus berkoordinasi dengan pihak berwenang dalam proses investigasi guna mengetahui penyebab pasti insiden tersebut. ASDP berkomitmen mendukung penuh proses investigasi yang berlangsung serta melakukan evaluasi menyeluruh sebagai bagian dari upaya memperkuat standar keselamatan operasional. “Keselamatan dan keamanan pengguna jasa serta seluruh insan yang bekerja di lingkungan operasional ASDP akan selalu menjadi prioritas utama perusahaan. Kami berkomitmen untuk terus meningkatkan aspek keselamatan sebagai bagian dari tanggung jawab kami dalam memberikan layanan penyeberangan yang andal dan aman,” ujar Heru.",kebakaran,"aceh, banda aceh, indonesia, jakarta",2,,2026-06-15T19:04:33.813540+00:00
liputan6.com_8f44262b3a96,KM Mutiara Sentosa Ditenggelamkan Usai Penumpang Dievakuasi,https://www.liputan6.com/tv/read/2958557/km-mutiara-sentosa-ditenggelamkan-usai-penumpang-dievakuasi,Liputan6.com,2017-05-20T18:22:27+07:00,Liputan6.com,"Liputan6.com, Sumenep - Kapal Mutiara Sentosa terbakar di perairan Masalembu, Sumenep, Jawa Timur. Hingga Sabtu siang, asap hitam masih membumbung tinggi saat kapal ditenggelamkan di wilayah Karang Jompong. Dari pantauan melalui helikopter Basarnas, kebakaran di dalam kapal belum sepenuhnya berhasil dipadamkan. Seperti ditayangkan Liputan 6 Petang SCTV, Sabtu (20/5/2017), pihak Syahbandar Tanjung Perak Surabaya mulai bersiap menyambut kedatangan para korban di perairan Masalembu. Mereka telah mendirikan posko evakuasi di Gapura Surya, Pelabuhan Tanjung Perak. Atas peristiwa nahas pada Jumat malam, 19 Mei itu, hingga kini pihak Syahbandar Tanjung Perak belum mengambil tindak lanjut apapun, kecuali menenggelamkan kapal. ""Jadi untuk sementara kapal dikandaskan. Dikandaskan karena para penumpangnya sudah tidak adalagi. Sudah dievakuasi,"" ungkap Kabid Penjagaan dan Penyidikan Syahbandar Tanjung Perak Edi Sumarsono. Sementara itu, dari seluruh penumpang dan ABK KM Mutiara Sentosa berhasil dievakuasi, korban tewas berjumlah lima orang, sedangkan sebagian korban luka masih dalam perawatan di Puskesmas Masalembu. Untuk korban selamat, kini tengah dalam perjalanan menuju Pelabuhan Tanjung Perak, Surabaya. Saksikan video penenggelaman KM Mutiara Sentosa yang terbakar di perairan Masalembu, Sumenep.","evakuasi, kebakaran","jawa timur, surabaya",4,,2026-06-15T19:04:55.241402+00:00
liputan6.com_635981605f1c,Basarnas Evakuasi Para Korban KM Mutiara Sentosa,https://www.liputan6.com/tv/read/2958334/basarnas-evakuasi-para-korban-km-mutiara-sentosa,Liputan6.com,2017-05-20T13:11:23+07:00,Liputan6.com,"Liputan6.com, Sumenep - Polres Sumenep langsung mengambil langkah penyelamatan 200 penumpang termasuk ABK KM Mutiara Santosa 1 jurusan Surabaya-Balikpapan yang terbakar di Perairan Masalembu. Seperti ditayangkan Liputan 6 Siang SCTV, Sabtu (20/5/2017), Tim Basarnas dari Balikpapan juga turut membantu dengan mengerahkan Kapal Wisanggeni. Tim Basarnas bersama Polres Sumenep akhirnya mengevakuasi para penumpang KM Mutiara Santosa 1. Terhitung sejak pukul 23.30 WIB, 41 korban sudah berada di Puskesmas Masalembu. Sedangkan 59 korban berada di Syahbandar. Kemudian 30 korban berada di lambung kapal dan 60 korban lainnya dalam perjalanan menuju daratan. Dari hasil keterangan para ABK yang dihimpun Polsek Masalembu, dugaan sementara kebakaran berasal dari sebuah kendaraan di lambung kapal. Selain fokus upaya penyelamatan para penumpang, polisi juga menyelidiki penyebab pasti insiden kebakaran KM Mutiara Santosa 1 ini. Saksikan tayangan video Tim Basarnas membantu mengevakuasi para korban KM Mutiara Sentosa selengkapnya.","evakuasi, kebakaran","balikpapan, surabaya",2,,2026-06-15T19:05:03.739491+00:00
liputan6.com_c3c3a132e25a,Video Amatir Kebakaran Stasiun Klender,https://www.liputan6.com/tv/read/2958179/video-amatir-kebakaran-stasiun-klender,Liputan6.com,2017-05-20T02:50:18+07:00,Liputan6.com,"Liputan6.com, Jakarta - Sebuah rekaman video amatir memperlihatkan kebakaran yang menghanguskan Stasiun Klender, Jakarta Timur, Jumat pagi. Warga sekitar maupun petugas terlihat tak mampu berbuat banyak. Seperti ditayangkan Liputan 6 Siang SCTV, Jumat (19/5/2017), pengguna jasa kereta api yang sudah mulai berdatangan ke stasiun juga ikut panik. Sebab, kobaran api terus membesar dan menyambar barang-barang yang mudah terbakar. Belasan unit mobil pemadam kebakaran langsung dikerahkan untuk memadamkan api. Namun, api yang berkobar terus membakar kantor PT KAI, tempat penjualan tiket, hingga menjalar ke kamar mandi. Kobaran api baru bisa dipadamkan setelah sekitar satu jam petugas kebakaran berjibaku. Namun, sebagian besar bangunan milik PT KAI itu ludes terbakar. Kebakaran di Stasiun Klender juga berdampak ke stasiun lain. Di Stasiun Cakung, ratusan calon penumpang terpaksa mencari alternatif transportasi agar bisa mencapai lokasi tujuan. Bahkan, ada yang membatalkan perjalanan karena tak mudah melanjutkan perjalanan dengan moda transportasi lain. Sebab, terjadi kemacetan parah di lokasi yang akan dilewati. Kebakaran ini mengakibatkan Stasiun Klender tidak bisa melayani penumpang KRL untuk beberapa hari ke depan. Akibatnya, pelayanan berpindah ke stasiun terdekat seperti Jatinegara dan Buaran. Saksikan video amatir kebakaran di Stasiun Klender selengkapnya berikut ini.",kebakaran,jakarta,1,,2026-06-15T19:05:07.544689+00:00
sindonews.com_6ec09c586395,"Bangun MIN 5 Pidie Jaya yang Hanyut Akibat Banjir, Kemenag Alokasikan Rp12 Miliar",https://daerah.sindonews.com/read/1717511/174/bangun-min-5-pidie-jaya-yang-hanyut-akibat-banjir-kemenag-alokasikan-rp12-miliar-1781431615,Sindonews.com,,,"Raih Penghargaan Garda Kemanusiaan Aceh, Safrizal: Penanganan Bencana Kerja Kolaboratif Perbaikan Aceh Alami Kemajuan Signifikan, Satgas PRR: Warga Mulai Tatap Masa Depan",banjir,aceh,2,,2026-06-15T19:06:15.138556+00:00
sindonews.com_8f8c271a2911,BNPB: Bencana Banjir hingga Karhutla Melanda 4 Daerah,https://daerah.sindonews.com/read/1717487/174/bnpb-bencana-banjir-hingga-karhutla-melanda-4-daerah-1781424410,Sindonews.com,,,"Raih Penghargaan Garda Kemanusiaan Aceh, Safrizal: Penanganan Bencana Kerja Kolaboratif BNPB Petakan Karhutla di Sejumlah Wilayah, Sumatera dan Kalimantan Mendominasi","banjir, bnpb","aceh, bnpb, kalimantan, sumatera",1,,2026-06-15T19:06:17.282112+00:00
sindonews.com_518315833369,"Raih Penghargaan Garda Kemanusiaan Aceh, Safrizal: Penanganan Bencana Kerja Kolaboratif",https://daerah.sindonews.com/read/1717225/174/raih-penghargaan-garda-kemanusiaan-aceh-safrizal-penanganan-bencana-kerja-kolaboratif-1781345192,Sindonews.com,,,"Bangun MIN 5 Pidie Jaya yang Hanyut Akibat Banjir, Kemenag Alokasikan Rp12 Miliar BNPB: Bencana Banjir hingga Karhutla Melanda 4 Daerah","banjir, bnpb","aceh, bnpb",3,,2026-06-15T19:06:25.117251+00:00
sindonews.com_313c8930619a,Gulkarmat Jakarta Evakuasi 26 Penumpang Kapal di Perairan Kepulauan Seribu,https://daerah.sindonews.com/read/1717163/6/gulkarmat-jakarta-evakuasi-26-penumpang-kapal-di-perairan-kepulauan-seribu-1781330769,Sindonews.com,,,"Kapal-kapal Wisata Berbendera Asing di Teluk Jakarta Disegel, Ini Alasannya Kepadatan Puncak Arus Balik 2026, 6 Kapal Tambahan Disiapkan di Pelabuhan Bakauheni",evakuasi,jakarta,2,,2026-06-15T19:06:30.474396+00:00
sindonews.com_da4c556102d4,"BNPB Petakan Karhutla di Sejumlah Wilayah, Sumatera dan Kalimantan Mendominasi",https://daerah.sindonews.com/read/1717101/174/bnpb-petakan-karhutla-di-sejumlah-wilayah-sumatera-dan-kalimantan-mendominasi-1781319965,Sindonews.com,,,BNPB: Bencana Banjir hingga Karhutla Melanda 4 Daerah 15 Ribu Hektare Lahan Hangus Akibat Karhutla di Aceh dan Riau,"banjir, bnpb","aceh, bnpb, kalimantan, riau, sumatera",1,,2026-06-15T19:06:33.371958+00:00
