id,title,url,source,published_date,author,content,disaster_keywords_found,indonesia_location_keywords_found,event_score,rejection_reason,scraped_at
detik.com_54565267319d,"Malam Panjang Dokter Iqbal, Selamatkan 5 Nyawa di Tragedi Stasiun Bekasi Timur",https://news.detik.com/berita/d-8492844/malam-panjang-dokter-iqbal-selamatkan-5-nyawa-di-tragedi-stasiun-bekasi-timur,Detik.com,2026-05-18T06-23-58Z,20Detik,"Ramai, panas, dan tidak tertata. Suasana itu masih melekat di benak Muhammad Iqbal El Mubarak ketika ia tiba di Stasiun Bekasi Timur pada 27 April 2026 malam hari. Satu jam sebelumnya, tabrakan maut antara KRL dan KA Argo Bromo Anggrek baru saja terjadi. Iqbal, yang saat itu tengah menyetir pulang dari sebuah mal, langsung tancap gas menuju lokasi dan menunda kepulangannya. Begitu mendapat akses masuk ke stasiun, dokter spesialis bedah itu bergabung dengan tim medis lain dan bergegas menuju gerbong perempuan. Di sana masih ada lima orang korban yang terjepit hebat. Iqbal menuturkan, kondisi kelimanya tampak semakin lemah, terlihat dari denyut nadi mereka yang terus menurun. ""(Kaki para korban) terjepit material-material dari kereta api, karena lantai kereta itu terangkat dan berlipat-lipat. Jadi ankle mereka benar-benar terjepit, sampai kadang-kadang sulit sekali ditarik,"" terang Iqbal dalam program Sosok detikcom (18/5/2026). Sembari terus menstabilkan kondisi vital para korban, Iqbal menyaksikan tim Basarnas berusaha menyingkirkan material yang menjepit tubuh mereka. Namun, setiap kali besi bergeser, jeritan para korban melengking nyaring. Iqbal sadar, para korban tak akan bisa diselamatkan jika proses evakuasi terus dilakukan dalam kondisi sadar. Setitik keraguan sempat muncul di benaknya, tetapi segera ia tepis. ""Sempat bingung. Mau bagaimana kita menanganinya? Tapi kami tetap optimistis. Kalau di bedah ada semboyan, 'Pantang pulang sebelum tugas berhasil'. Jadi saya juga berpikir seperti itu. Korban yang masih hidup ini nggak boleh meninggal di depan mata saya,"" tegas Iqbal. Malam semakin larut, dan Iqbal berpacu dengan waktu. Momen itu mengingatkannya pada masa-masa ketika ia menjadi relawan di berbagai wilayah krisis selama beberapa tahun terakhir; Aceh Tamiang, Sigi, Lombok, Myanmar, Turki, hingga Gaza. Ia terbiasa menghadapi keterbatasan alat, jumlah korban kritis yang terus bertambah, hingga risiko keselamatan diri yang tak selalu terjamin. Namun pengalaman-pengalaman itulah yang menyiapkannya untuk hadir ketika kondisi darurat memanggil. Di tengah kepanikan malam itu di Stasiun Bekasi Timur, Iqbal mencetuskan ide untuk membius total para korban agar mereka tidak merasakan sakit saat material yang menjepit tubuh mereka disingkirkan. Ia mengaku, gagasan tersebut muncul setelah teringat misi penyelamatan heroik tim sepak bola Wild Boars di gua Tham Luang, Thailand, pada 2018 silam. Orang pertama yang akan dibius Iqbal adalah Nurul, gadis berusia 21 tahun. Setelah menjelaskan prosedur yang akan dilakukan, Iqbal menyuntikkan obat bius ke tubuh Nurul. Saat Nurul tak lagi sadarkan diri, tim Basarnas dengan cepat menyingkirkan material yang menjepit tubuhnya, lalu menggotongnya keluar dari gerbong. Begitu pula korban kedua hingga kelima. Langit di atas Stasiun Bekasi Timur mulai terang dan hari telah berganti. Rasa lelah menghantam tubuh Iqbal yang semalaman belum sempat beristirahat. Namun di balik letih itu, rasa lega menyeruak kuat. Sekali lagi, Iqbal berhasil menyelamatkan mereka yang nyawanya berada di ujung tanduk. Kini, Iqbal kembali ke rutinitasnya berpraktik di RSUD Kramat Jati. Meski demikian, panggilan untuk turun langsung membantu korban bencana tak pernah benar-benar jauh dari hidupnya. Sebab inilah ikhtiar Iqbal untuk membantu sesama, baik mereka yang berada di ruang perawatan rumah sakit maupun mereka yang bertaruh nyawa di tengah lokasi bencana. ""Kalau yang penting bagi saya, saya bahagia. Bisa memberikan kontribusi kepada umat, kepada masyarakat dan bangsa, kalau perlu dunia. Jadi saya pikir, ngapain juga gitu, saya ke daerah perang, minum susah, makan susah, terancam nyawa? Tapi ada kebahagiaan, ada titik spiritual yang tersentuh, saya bahagia, senang melakukan seperti ini,"" tutur Iqbal. Saksikan selengkapnya kisah dari dr. Iqbal El Mubarak di program Sosok detikcom dalam kanal 20Detik.",evakuasi,aceh,5,,2026-06-15T19:00:58.858732+00:00
detik.com_0604f035962f,Sukaraharja Cianjur Jadi Satu-satunya Desa Tertinggal di Jabar,https://www.detik.com/jabar/berita/d-8486412/sukaraharja-cianjur-jadi-satu-satunya-desa-tertinggal-di-jabar,Detik.com,2026-05-12T18:00:00-18:00,Ikbal Selamet,"Kabar memprihatinkan datang dari pelosok Cianjur. Pasalnya, Desa Sukaraharja, Kecamatan Kadupandak, Cianjur, menjadi satu-satunya desa di Jawa Barat yang berstatus desa tertinggal. Bencana alam dan minimnya fasilitas publik diduga menjadi penyebab status tersebut. Kepala Desa Sukaraharja, Budi Rahman, mengatakan predikat desa tertinggal tersebut didasarkan pada penilaian Indeks Desa (ID), mulai dari tata kelola pemerintahan, layanan dasar, sosial, ekonomi, lingkungan, hingga aksesibilitas. ""Kami mengisi penilaian Indeks Desa terkait kondisi sarana prasarana serta fasilitas yang tidak layak seperti pustu sekolah bahkan MCK,"" kata dia, Selasa (12/5/2026). Menurut dia, kondisi tersebut diperparah dengan bencana alam yang membuat akses jalan sulit. ""Akses jalan rusak karena bencana longsor dan pergerakan tanah, sampai sekarang belum rampung diperbaiki,"" kata dia. Dia menuturkan, kondisi tersebut membuat perekonomian juga terdampak. Pasalnya, harga kebutuhan pokok melonjak dibandingkan harga pasar pada umumnya. ""Misalnya harga elpiji 3 Kg sampai ke tangan masyarakat hingga Rp40 ribu per tabung karena biaya operasionalnya tinggi akibat akses jalan yang sulit dilalui,"" tuturnya. Budi berharap ada bantuan dari pemerintah terkait persoalan sarana dan prasarana, sehingga Desa Sukaraharja dapat naik status menjadi desa berkembang. ""Tentunya kami berharap bantuan, sebab permasalahan sarana dan prasarana tidak ter-cover dana desa. Minimal kami ingin statusnya berkembang,"" pungkasnya. Sementara itu, Sekretaris Dinas Pemberdayaan Masyarakat Desa (DPMD) Kabupaten Cianjur, Dendi Kristanto, mengatakan predikat desa tertinggal tersebut berdasarkan penilaian pada 2025. ""Jadi pengisiannya tahun lalu, sehingga predikatnya muncul di tahun ini. Faktor utamanya karena dampak bencana alam yang merusak akses jalan. Ditambah terkait sarana puskesmas pembantu,"" kata dia. Menurut dia, sebelum terdampak bencana, Desa Sukaraharja berpredikat desa berkembang. ""Kemudian turun jadi desa tertinggal, karena indikator yang semula hanya tiga menjadi ada enam indikator penilaian,"" kata dia. Dia menegaskan, bantuan untuk perbaikan dan pembangunan sarana prasarana desa akan dimulai tahun ini hingga 2027 mendatang. Tujuannya agar status desa bisa kembali naik dan tidak ada lagi desa tertinggal di Cianjur. ""Karena ini satu-satunya di Jabar, jadi dari Pemprov juga sudah turun ke lokasi untuk turut memberikan bantuan. Secepatnya sarana prasarana serta infrastruktur jalan akan diperbaiki agar minimalnya tidak ada lagi desa tertinggal di Cianjur,"" pungkasnya.",longsor,"jawa barat, kabupaten",4,,2026-06-15T19:01:03.743783+00:00
detik.com_83c8b8c98908,"77 Rumah di Lhokseumawe Aceh Ludes Terbakar, Pemicu Korsleting Listrik",https://www.detik.com/sumut/berita/d-8476137/77-rumah-di-lhokseumawe-aceh-ludes-terbakar-pemicu-korsleting-listrik,Detik.com,2026-05-05T22-29-34Z,Agus Setyadi,"77 rumah warga di Kompleks Pardede, Kampung Jawa Lama, Kecamatan Banda Sakti, Kota Lhokseumawe, Aceh ludes terbakar akibat korsleting listrik. Kebakaran menyebabkan 251 jiwa terpaksa mengungsi. Informasi diperoleh detikSumut, api awalnya berasal dari lantai dua rumah seorang warga, Selasa (5/5/2026) sekitar pukul 12.30 WIB. Api dengan cepat menjalar ke rumah sekitarnya sehingga sulit dikendalikan. Petugas pemadam sempat mengalami kendala saat memadamkan api karena akses menuju lokasi terbilang sempit. Selain itu rumah yang terbakar rata-rata berkonstruksi kayu dan terletak berdekatan. Api dapat dipadamkan setelah 10 armada pemadam serta satu unit mobil water canon dikerahkan ke lokasi. Proses pemadaman melibatkan berbagai pihak termasuk TNI/Polri. ""Kobaran api dengan cepat meluas lantaran kondisi rumah yang berdempetan, cuaca panas, serta tiupan angin kencang dari arah laut. Proses pemadaman pun sempat mengalami kendala akibat akses jalan yang sempit dan padatnya permukiman warga,"" kata Kapolres Lhokseumawe AKBP Ahzan dalam keterangannya. Ahzan menjelaskan, api berhasil dipadamkan sekitar pukul 15.00 WIB. Menurutnya, tidak ada korban jiwa dalam musibah itu. ""Dugaan sementara kebakaran dipicu korsleting arus listrik,"" jelas Ahzan. Ahzan mengimbau masyarakat untuk tetap waspada dan menjaga barang-barang berharga di tengah situasi darurat. ""Kami turut prihatin atas kejadian ini. Personel juga kami siagakan untuk membantu pengamanan dan menjaga harta benda milik warga agar tetap aman,"" ujarnya.","kebakaran, korban jiwa","aceh, kota",2,,2026-06-15T19:01:08.349986+00:00
detik.com_8fcaa48f3b4f,"Dibuka Warga Secara Swadaya, Jembatan Enang-Enang Dibangun Kembali 2027",https://www.detik.com/sumut/berita/d-8533537/dibuka-warga-secara-swadaya-jembatan-enang-enang-dibangun-kembali-2027,Detik.com,2026-06-15T21-44-51Z,Agus Setyadi,"Jalan dan Jembatan Enang-Enang di Bener Meriah, Aceh, yang rusak akibat bencana diperbaiki warga secara swadaya. Pemerintah bakal membangun kembali jembatan ambruk tersebut tahun depan. ""Enang-Enang itu sebenarnya kita sudah programkan di 2027,"" kata Plt Kepala Balai Pelaksana Jalan Nasional (BPJN) Aceh, Zulkarnaini kepada wartawan, Senin (15/6/2026). BPJN mengaku sudah bertemu dengan Pemerintah Kabupaten Bener Meriah dan perwakilan warga yang membuka kembali jalan tersebut. Jalan dan jembatan disebut diperbaiki masyarakat yang ingin ke kebun agar tidak memutar terlalu jauh. Jalan dan jembatan Enang-Enang merupakan akses utama dari Bireuen-Aceh Tengah. Selama jembatan ambruk, pemerintah membuka jalur alternatif dari Burlah ke Simpang Lancang. Menurutnya, warga memperbaiki jembatan itu agar dapat melewatinya dengan motor atau berjalan kaki. BPJN tidak merekomendasikan jembatan tersebut dilalui mobil atau truk. ""Kita belum bisa rekomendasi untuk roda empat melewati Enang-Enang. Kalau untuk dilewati sepeda motor atau pejalan kaki mungkin bisa,"" jelas Zulkarnaini. Zulkarnaini mengimbau masyarakat dengan kendaraan bermuatan berat agar tidak melewati Enang-Enang. Pihaknya tidak dapat menjamin kekokohan jembatan tersebut. ""Kita sudah siapkan jalan alternatif ke Burlah yang digunakan setelah bencana alam kemarin. Jadi sampai hari ini masih digunakan jalan tersebut. Dan kita juga sudah meningkatkan jalan tersebut dengan kita melebarkan kiri kanan masing-masing satu meter yaitu dari jalan 4 menjadi 6 meter. Itu sudah kita kerjakan,"" ujarnya. Sebelumnya, jalan nasional dan jembatan di Tajuk Enang-Enang, Kecamatan Pintu Rime Gayo, Bener Meriah mengalami rusak parah akibat bencana akhir November 2025. Enam bulan pasca musibah, warga turun tangan memperbaiki jalan itu agar dapat dilalui kembali. Warga secara patungan mengerahkan satu alat berat untuk membersihkan material longsor yang menutup badan jalan. Masyarakat juga membuat jalur alternatif untuk titik yang sudah tidak dapat dilewati. Salah satu ujung jembatan yang ada di lokasi jatuh ke sungai. Warga menimbun bagian tersebut dan membuat jalur baru agar dapat terhubung. Kondisi jembatan di jalan utama Bireuen-Aceh Tengah itu dalam keadaan miring. Dalam video beredar, kendaraan roda dua dan empat sudah dapat melintas meski harus berhati-hati. Tokoh masyarakat di Kecamatan Pintu Rime Gayo, Sahrial Abadi menjelaskan, sejumlah warga melakukan patungan untuk mengumpulkan uang agar alat berat dapat bekerja membuka akses. Sahrial mengaku menjual sebagian kebunnya agar dapat menyumbang. ""Terkait Jembatan Enang-Enang ini kami melakukan swadaya masyarakat. Selama ini kami selalu memakai jalan alternatif melewati Burlah ke Simpang Lancang, namun jalan tersebut sudah banyak sekali yang rusak,"" kata Sahrial kepada wartawan, Selasa (2/6). Menurutnya, jalan alternatif di Wih Porak itu sempit sehingga memperlambat perjalanan. Selain itu, banyak keluhan dari warga terkait kondisi jalan tersebut. ""Kami berinisiatif melihat sempitnya jalan di sana bisa memperlambat perjalanan dan banyaknya keluhan masyarakat. Kami mengalami inisiatif mengumpulkan dana beberapa orang,"" jelasnya.",longsor,"aceh, kabupaten",2,,2026-06-15T19:01:12.944129+00:00
detik.com_364815af2f78,"Hakim Tolak Praperadilan Bupati Sitaro Chyntia, Status Tersangka Tetap Sah",https://www.detik.com/sulsel/hukum-dan-kriminal/d-8533536/hakim-tolak-praperadilan-bupati-sitaro-chyntia-status-tersangka-tetap-sah,Detik.com,2026-06-15T21:00:00+00:00,Fistel Arlando Mukuan,"Hakim tunggal Pengadilan Negeri Manado (PN Manado) menolak permohonan Praperadilan Bupati Sitaro, Chyntia Kalangit yang ditetapkan tersangka untuk ditinjau kembali. Status tersangka Chyntia dalam kasus korupsi dana siap pakai (DSP) pascabencana erupsi Gunung Api Ruang tahun anggaran 2024 tetap sah. ""Mengadili, satu menolak permohonan praperadilan, dua, menghukum pemohon untuk membayar biaya perkara,"" ujar hakim tunggal Philip Pangalila saat membacakan amar putusan di PN Manado, Senin (15/6/2026). Sidang putusan dilaksanakan di Pengadilan Negeri Manado, pada Senin (15/6) sore hingga malam. Putusan hakim diapresiasi Kejati Sulut. ""Kami mengapresiasi putusan Hakim Praperadilan hari ini yang menolak permohonan dari pihak Pemohon,"" kata Kasipenkum Kejati Sulut, Januar Boli Tobi. Januar mengatakan sejak awal pihaknya meyakini tim penyidik telah mengantongi minimal dua alat bukti yang sah sebelum menetapkan tersangka dalam perkara tersebut. Menurutnya, seluruh tahapan yang dilakukan penyidik telah melewati prosedur yang ketat. ""Sejak awal kami meyakini bahwa Tim Penyidik telah mengantongi minimal dua alat bukti yang sah dan melewati prosedur yang sangat ketat sebelum mengambil tindakan hukum dalam perkara ini,"" imbuhnya. Dia menilai putusan hakim menjadi bukti bahwa langkah hukum yang dilakukan Kejaksaan telah sesuai koridor hukum. Kejaksaan kini fokus menyelesaikan berkas perkara utama dan akan memberikan perkembangan terkait pelimpahan berkas. ""Fokus kami sekarang adalah merampungkan berkas perkara utama. Kami berkomitmen untuk menuntaskan perkara ini secara transparan dan akuntabel demi kepastian hukum masyarakat,"" bebernya. Sementara itu, kuasa hukum pemohon, Munsir, menyatakan pihaknya akan mempelajari putusan hakim lebih lanjut. Dia menilai terdapat sejumlah fakta persidangan yang menjadi perhatian pihaknya. ""Kalau kita lihat fakta persidangan dan keterangan ahli kami justru surat itu sebenarnya disampaikan ke KPK, ini yang membuat kami bingung,"" ujar Munsir. Munsir juga menyoroti kehadiran ahli dalam persidangan yang menurutnya tidak pernah direkomendasikan oleh pemberi kuasa kepada penerima kuasa. Keberatan tersebut, kata dia, telah disampaikan kepada hakim tunggal selama proses persidangan. ""Kami sudah jelaskan tapi masih juga dipertimbangkan oleh hakim, itu yang membuat kami amat terluka,"" katanya. Meski demikian, pihak pemohon masih meyakini Chyntia tidak bersalah dalam perkara tersebut. Mereka juga akan mendalami putusan yang baru dibacakan hakim. ""Putusan saat ini akan kami dalami sedalam-dalamnya, kami masih yakin ibu Bupati Sitaro tidak bersalah dalam perkara ini,"" pungkasnya. Diketahui, total sudah ada lima orang yang ditetapkan sebagai tersangka kasus korupsi dana bencana yang merugikan negara Rp 22,7 miliar ini. Selain Chyntia, Kejati Sulut sebelumnya lebih dulu menetapkan empat tersangka lainnya, yakni mantan Penjabat Bupati Sitaro Joy Oroh, Sekda Sitaro Denny Kondoj, Kepala BPBD Sitaro Joy Sigune, serta pihak swasta atau rekanan bernama Denny Tondolambung. Asisten Tindak Pidana Khusus Kejaksaan Tinggi Sulawesi Utara, Zein Yusri Munggaran, mengungkap sejumlah peran Chyntia dalam perkara tersebut. Salah satunya, Chyntia dianggap bertanggung jawab secara fisik maupun keuangan terhadap penyaluran dana bantuan. ""Kedua CIK melakukan pengorganisiran terhadap penyaluran bahan material dan membiarkan penyaluran bantuan yang sudah berlarut-larut,"" kata Zein kepada wartawan di kantor Kejati Sulut, Rabu (6/5). Menurut Zein, Chyntia juga memerintahkan Kepala BPBD Sitaro, Joy Sigune, untuk menunjuk lima toko sebagai penyalur material bantuan kepada warga terdampak. Penunjukan itu disebut bertentangan dengan petunjuk teknis dan surat dari Deputi BNPB. ""Kemudian tersangka mengakomodir dan mengorganisir bahan material yang akan disalurkan kepada masyarakat penerima bantuan dengan tujuan untuk mencari untung,"" bebernya. ""CIK juga memerintahkan JS untuk menunjuk toko berdasarkan hubungan kekerabatan yakni mantan tim sukses yang bukan merupakan toko bangunan,"" tambah Zein.","bnpb, bpbd, erupsi","bnpb, bpbd, manado, sulawesi",2,,2026-06-15T19:01:15.304444+00:00
cnnindonesia.com_309fbe597510,Kecelakaan Maut di Pidie Aceh Tewaskan Empat Orang,https://www.cnnindonesia.com/nasional/20260615133339-12-1369327/kecelakaan-maut-di-pidie-aceh-tewaskan-empat-orang,CNNIndonesia.com,2026-06-15T13:42:49,,"Kecelakaan antara bus penumpang dengan dua sepeda motor terjadi di kawasan Caleu, Kecamatan Indrajaya, Kabupaten Pidie, Aceh, menewaskan empat orang. Kepala Satuan Lalu Lintas Polres Pidie AKP Aiyup Sami di Pidie, Senin, mengatakan kecelakaan antara bus angkutan umum dan dua sepeda motor itu terjadi pada Minggu (14/6) sekitar pukul 21.20 WIB. ""Empat orang meninggal dunia dalam kecelakaan antara bus penumpang dan dua sepeda motor. Saat ini kasus tersebut masih dalam penanganan kepolisian,"" kata Aiyup Sami. Korban meninggal dunia yakni Anadia (33) dan Rustina (57), keduanya warga Gampong Seukee, Kecamatan Simpang Tiga, Kabupaten Pidie. Selain itu, Cut Raisya Naisyira (13) dan Zurratul Wilza (13), yang tercatat sebagai warga Gampong Krueng Seumideun, Kecamatan Peukan Baro, Kabupaten Pidie. Aiyup Sami mengatakan kecelakaan bermula ketika bus penumpang JRG melaju dari arah Banda Aceh menuju Bireuen. Setibanya di lokasi kejadian, sebuah sepeda motor yang berada di sisi kiri jalan hendak berbelok ke kanan. Karena jarak sudah terlalu dekat, pengemudi bus tidak sempat menghindar sehingga menabrak sepeda motor tersebut. Setelah itu, bus juga menabrak sepeda motor lain yang melaju dari arah berlawanan. Kecelakaan itu membuat pengendara dan penumpang dari kedua sepeda motor meninggal dunia. Sementara itu, ketiga kendaraan yang terlibat kecelakaan mengalami kerusakan berat. ""Lokasi kejadian dalam kondisi gelap karena terjadi pada malam hari. Permukaan jalan saat kecelakaan dalam kondisi kering. Petugas juga telah mengamankan ketiga kendaraan yang terlibat kecelakaan tersebut,"" kata Aiyup Sami.",kerusakan,"aceh, banda aceh, kabupaten",3,,2026-06-15T19:01:36.306726+00:00
cnnindonesia.com_97199031e12f,"Banjir-Longsor di Sinjai Sulsel, Puluhan Rumah Terdampak",https://www.cnnindonesia.com/nasional/20260607155125-20-1366362/banjir-longsor-di-sinjai-sulsel-puluhan-rumah-terdampak,CNNIndonesia.com,2026-06-07T18:30:09,,"Bencana banjir dan longsor melanda Kabupaten Sinjai, Sulawesi Selatan, akibat hujan dengan intensitas sedang hingga lebat yang menyebabkan tiga kecamatan terdampak. ""Bencana ini dipicu hujan dengan intensitas sedang dan lebat melanda wilayah tersebut, hingga ada tiga kecamatan terdampak,"" kata Kepala Pusat Data, Informasi dan Komunikasi Kebencanaan BNPB, Abdul Muhari dalam keterangannya, Minggu (7/6). Hujan tersebut melanda Kabupaten Sinjai sejak Rabu (3/6) hingga Kamis (4/6), menyebabkan banjir di Kecamatan Sinjai Timur, Sinjai Utara, dan Tellu Limpoe. ""Banjir dan longsor dipicu hujan dengan intensitas sedang hingga lebat yang melanda wilayah tersebut. Kondisi diperparah oleh tanah yang labil sehingga memicu longsor di beberapa lokasi,"" ungkapnya. Pesisir Karawang Kritis, Abrasi Lenyapkan Rumah Warga Desa Cemarajaya Gunung Lewotobi Erupsi, Semburan Abu Vulkanik 2,5 Km Gunung Lewotobi Laki-laki di NTT Meletus Jumat Malam Berdasarkan data BPBD, terdapat desa/kelurahan yang terdampak longsor yakni, Desa Panaikang, Lasiai, Saukang, dan Sanjai di Kecamatan Sinjai Timur. Kemudian Desa Bua dan Lembang Lohe di Kecamatan Tellu Limpoe, Desa Tompobulu di Kecamatan Bulupoddo, Desa Aska dan Kelurahan Biringere di Kecamatan Sinjai Selatan, serta Kelurahan Lamatti Rilau di Kecamatan Sinjai Utara. Muhari menyebutkan dampak banjir tersebut terdapat 21 rumah warga terdampak, 60 hektar sawah terendam dan dua ekor kuda mati tenggelam. ""Banjir juga menyebabkan 11 ruas jalan, enam unit perkantoran, satu fasilitas umum, dan dua fasilitas pendidikan terdampak. Kondisi banjir pada Kamis (4/6) telah surut, namun akses jalan penghubung Desa Sukamaju dan Erabaru di Kecamatan Tellu Limpoe masih terputus,"" jelasnya. Sementara itu, tanah longsor menyebabkan tujuh rumah warga, satu hektar lahan persawahan, satu jembatan, dan enam ruas jalan penghubung antardesa terdampak. ""Selain itu, tanah longsor juga menyebabkan pipa PDAM terputus sehingga mengganggu pasokan air bersih ke wilayah Dusun Waetuo,"" katanya. Meski demikian, kata Muhari, bencana tersebut tidak sampai menimbulkan korban jiwa. Namun, beberapa warga mengungsi setelah rumahnya terdampak. ""Material longsor masih menutupi sebagian badan jalan, namun masih dapat dilalui kendaraan roda empat. Sementara itu, perbaikan pipa PDAM yang rusak masih terus diupayakan,"" katanya.","abrasi, banjir, bnpb, bpbd, erupsi, korban jiwa, longsor, tanah longsor","bnpb, bpbd, kabupaten, ntt, sulawesi",7,,2026-06-15T19:01:43.153668+00:00
cnnindonesia.com_0b542d56bce5,250 Rumah dan 330 KK Kena Dampak Kebakaran di Kebon Kosong Kemayoran,https://www.cnnindonesia.com/nasional/20260602063403-20-1364298/250-rumah-dan-330-kk-kena-dampak-kebakaran-di-kebon-kosong-kemayoran,CNNIndonesia.com,2026-06-02T06:43:58,,"Sekitar 250 rumah dan 330 Kepala Keluarga (KK) terdampak atas peristiwa kebakaran di kawasan Kebon Kosong, Kemayoran, Jakarta Pusat, Senin (1/6). Direktur Jenderal Bina Administrasi Kewilayahan Kementerian Dalam Negeri, Safrizal ZA mengatakan saat ini, pendataan sedang dilakukan secara mendalam, mencakup warga terdampak di dua RW, yakni RW 04 yang meliputi lima RT (RT 12, 13, 14, 15, dan 16) serta RW 05 yang mencakup tiga RT (RT 01, 02, dan 03). Pemerintah menyiapkan titik lokasi pengungsian di Lapangan Jusuf Hamka, Jalan Benyamin Suaeb, agar pendataan dan koordinasi bantuan kedaruratan bencana kebakaran lebih efektif. Fasilitas pengungsian telah disiapkan dengan dukungan berbagai pihak. ""Tempat pengungsian sementara disiapkan agar warga tidak berkumpul di jalan dan bisa beristirahat, beserta dengan logistik yang disiapkan BPBD bekerja sama dengan Dinas Sosial, PMI, dan Baznas,"" jelas Safrizal di Jakarta, Selasa (2/5) dinihari. Tiga tenda telah disiapkan dari Dinas Sosial DKI Jakarta, dan sejumlah mobil logistik lainnya dari PMI hingga BPBD telah tiba di lokasi. Safrizal menjelaskan bahwa data tersebut akan mencakup detail mengenai usia sekolah untuk memastikan kebutuhan pendidikan anak tetap terpenuhi. Setelah situasi kedaruratan berakhir, pemerintah akan melakukan inventarisasi bangunan dan mendiskusikan langkah jangka panjang bagi warga. ""Nanti setelah semua kedaruratan ini selesai baru kita diskusikan seperti apa proses bagi warga masyarakat termasuk kemungkinan-kemungkinan kalau masyarakat ingin relokasi di tempat hunian yang lebih aman,"" kata Safrizal. Kebakaran yang melanda kawasan padat penduduk di Kampung Pasar Haji Ung, Jalan Kemayoran Gempol, Kebon Kosong, Kemayoran, Jakarta Pusat, pada Senin (1/6) malam tersebut bermula sekitar pukul 20.55 WIB. Dinas Gulkarmat DKI Jakarta mengerahkan 35 unit mobil pemadam dengan 165 personel untuk menjinakkan api yang diduga dipicu oleh korsleting listrik. Kepala Dinas Penanggulangan Kebakarandan Penyelamatan (Gulkarmat) DKI Jakarta, Bayu Meghantara memastikan bahwa sumber air di lokasi memadai. ""Alhamdulillah sumber air cukup,"" ujar Bayu. Ia pun memastikan petugas sigap menolong warga yang membutuhkan bantuan medis. ""Memang ada beberapa warga masyarakat yang dibawa ke rumah sakit itu karena luka ringan dan sesak karena asap,"" kata Bayu. Di tengah proses pemadaman, warga tampak hilir mudik mengevakuasi barang berharga ke area Lapangan Jusuf Hamka. Salah satu warga sekaligus Sekretaris Gabungan RT 12 hingga 16 RW04 Kebon Kosong, Supriatin, menceritakan kepanikan saat api mulai merambat ke area rumahnya. ""Saya baru pulang ngojek,apinya sudah besar. Saya panik karena istri saya sedang sakit di rumah,"" ungkap Supriatin. Supriatin menambahkan bahwa istrinya sempat mengalami sesak napas akibat paparan asap tebal di lokasi kejadian. Meski demikian, ia telah memastikan seluruh anggota keluarganya yang berjumlah tiga orang dalam kondisi selamat.","bpbd, kebakaran","bpbd, jakarta",3,,2026-06-15T19:01:45.488709+00:00
